{
  "$schema": "../../schema.json",
  "bittensor_id": "",
  "letter": "Ø¯",
  "name": "Agent Arena",
  "github": ["https://github.com/masa-finance/agent-arena-subnet"],
  "hw_requirements": "",
  "image_url": "https://assets.backprop.finance/subnet-logos/59/v1.jpg",
  "description": "",
  "bittensor_discord_id": "1310617172132888639",
  "team": "Masa",
  "summary": "Welcome to Agent Arena by Masa - the first competitive agent ecosystem where market forces and real engagement drive the evolution of sentient AI agents.",
  "websites": [
    {
      "label": "twitter",
      "url": "https://x.com/getmasafi"
    },
    {
      "label": "leaderboard",
      "url": "https://app.masa.ai/agent-arena"
    }
  ]
}
