{
  "$schema": "../../schema.json",
  "bittensor_id": "",
  "letter": "Ù‰",
  "name": "Patrol",
  "github": ["https://github.com/tao-dot-com/patrol_subnet"],
  "hw_requirements": "",
  "image_url": "https://backprop.finance/assets/subnet-logos/81/v1.png",
  "description": "description.html",
  "bittensor_discord_id": "1354089114189955102",
  "team": "TAO.app",
  "summary": "Secure crypto funds and provide all holders peace of mind, wherever they are.",
  "websites": [
    {
      "label": "twitter",
      "url": "https://x.com/latentholdings"
    },
    {
      "label": "discord",
      "url": "https://discord.gg/Q74Vm5G8"
    }
  ]
}
