
{
  "$schema": "../../schema.json",
  "bittensor_id": "",
  "letter": "",
  "name": "",
  "github": [],
  "hw_requirements": "",
  "image_url": "https://backprop.finance/assets/subnet-logos/default.png",
  "description": "",
  "bittensor_discord_id": "",
  "team": "",
  "summary": "",
  "websites": []
}
