{
  "$schema": "../../schema.json",
  "bittensor_id": "nas_chain",
  "letter": "×–",
  "name": "NAS Chain",
  "github": ["https://github.com/neuronlogic/NASChain"],
  "hw_requirements": "",
  "image_url": "",
  "description": "",
  "bittensor_discord_id": "1222990781577433232",
  "team": "NAS Chain",
  "summary": "NASChain is dedicated to optimizing neural architecture search (NAS). Contributors run NAS algorithms in search of models that maximize accuracy while minimizing computational costs.",
  "websites": [
    {
      "label": "twitter",
      "url": "https://x.com/naschain_ai"
    },
    {
      "label": "dashboard",
      "url": "https://dashboard.naschain.ai/leader-board"
    },
    {
      "label": "tplx_publication_link",
      "url": "https://medium.com/@tensorplexlabs/bittensor-subnet-review-sn31-neural-architecture-search-dd90b5d84f0b"
    }
  ]
}
