{
  "$schema": "../../schema.json",
  "bittensor_id": "proprietary_trading_network",
  "letter": "Î¸",
  "name": "Proprietary Trading Network",
  "github": ["https://github.com/taoshidev/proprietary-trading-network"],
  "hw_requirements": "",
  "image_url": "https://assets.backprop.finance/subnet-logos/8/v1.png",
  "description": "description.html",
  "bittensor_discord_id": "1162384774170677318",
  "team": "",
  "summary": "The Proprietary Trading Network incentivizes the contribution of profitable trading strategies across various financial markets. Contributors who provide the best trading signals receive the highest rewards, attracting skilled traders, data scientists, and machine learning teams to compete.",
  "websites": [
    {
      "label": "twitter",
      "url": "https://x.com/taoshiio"
    },
    {
      "label": "website",
      "url": "https://www.taoshi.io/"
    },
    {
      "label": "dashboard",
      "url": "https://dashboard.taoshi.io/"
    }
  ]
}
