{
  "$schema": "../../schema.json",
  "bittensor_id": "",
  "letter": "Ù‡",
  "name": "",
  "github": ["https://github.com/creativebuilds/sn77"],
  "hw_requirements": "",
  "image_url": "https://backprop.finance/assets/subnet-logos/default.png",
  "description": "",
  "bittensor_discord_id": "1351180132295118848",
  "team": "",
  "summary": "",
  "websites": []
}
