{
  "$schema": "../../schema.json",
  "bittensor_id": "",
  "letter": "×›",
  "name": "Web Agents",
  "github": ["https://github.com/autoppia/autoppia_web_agents_subnet"],
  "hw_requirements": "",
  "image_url": "https://assets.backprop.finance/subnet-logos/36/v1.png",
  "summary": "Web Agents Subnet leverages our Infinite Web Arena (IWA) benchmark to incentivize Bittensor miners to develop SOTA web agents.",
  "bittensor_discord_id": "1339356060787408996",
  "team": "Autoppia",
  "description": "",
  "websites": []
}
