{
  "$schema": "../../schema.json",
  "bittensor_id": "",
  "letter": "",
  "name": "vidaio",
  "github": ["https://github.com/vidaio-subnet/vidaio-subnet"],
  "hw_requirements": "",
  "image_url": "https://backprop.finance/assets/subnet-logos/85/v1.jpg",
  "description": "description.html",
  "bittensor_discord_id": "1342559689690583202",
  "team": "",
  "summary": "Revolutionizing Video Upscaling with AI-Driven Decentralisation",
  "websites": [
    {
      "label": "discord",
      "url": "https://discord.gg/Cn5VcGEb"
    },
    {
      "label": "website",
      "url": "https://vidaio.io"
    },
    {
      "label": "twitter",
      "url": "https://x.com/vidaio_"
    }
  ]
}
